{
  "$schema": "../../schemas/offboarding-taxonomy.schema.json",
  "metadata": {
    "version": "0.1.0",
    "lastUpdated": "2026-05-24",
    "legalBasis": [
      "《中华人民共和国劳动合同法》(2012修正)",
      "《中华人民共和国劳动合同法实施条例》",
      "《中华人民共和国劳动法》"
    ],
    "description": {
      "zh": "离职类型与原因标准分类体系，覆盖主动离职、被动离职、协商解除等全部场景",
      "en": "Offboarding type and reason taxonomy covering voluntary, involuntary, and mutual separation scenarios"
    }
  },

  "terminationTypes": [
    {
      "code": "VOLUNTARY",
      "name": { "zh": "主动离职", "en": "Voluntary Resignation" },
      "description": { "zh": "员工主动提出解除劳动合同", "en": "Employee-initiated contract termination" },
      "legalReference": "劳动合同法 第36条、第37条",
      "subtypes": [
        {
          "code": "RESIGNATION_NORMAL",
          "name": { "zh": "个人原因辞职", "en": "Resignation for Personal Reasons" },
          "noticePeriodDays": 30,
          "requiresApproval": false,
          "severanceApplicable": false,
          "reasons": [
            {
              "code": "CAREER_DEVELOPMENT",
              "name": { "zh": "个人职业发展", "en": "Career Development" },
              "category": "CAREER",
              "exitInterviewRecommended": true
            },
            {
              "code": "FAMILY_RELOCATION",
              "name": { "zh": "家庭搬迁/照顾家人", "en": "Family Relocation / Caregiving" },
              "category": "PERSONAL",
              "exitInterviewRecommended": true
            },
            {
              "code": "HEALTH_ISSUE",
              "name": { "zh": "健康原因", "en": "Health Reasons" },
              "category": "PERSONAL",
              "medicalCertificateRequired": true,
              "exitInterviewRecommended": true
            },
            {
              "code": "COMPENSATION_DISSATISFACTION",
              "name": { "zh": "薪酬不满", "en": "Compensation Dissatisfaction" },
              "category": "COMPENSATION",
              "exitInterviewRecommended": true,
              "retentionRiskFlag": true
            },
            {
              "code": "MANAGEMENT_CONFLICT",
              "name": { "zh": "管理冲突", "en": "Management Conflict" },
              "category": "MANAGEMENT",
              "exitInterviewRecommended": true,
              "retentionRiskFlag": true,
              "managementReviewRequired": true
            },
            {
              "code": "WORK_LIFE_BALANCE",
              "name": { "zh": "工作生活平衡", "en": "Work-Life Balance" },
              "category": "CULTURE",
              "exitInterviewRecommended": true,
              "retentionRiskFlag": true
            },
            {
              "code": "RELOCATION_CITY",
              "name": { "zh": "城市迁移", "en": "City Relocation" },
              "category": "PERSONAL",
              "exitInterviewRecommended": true
            },
            {
              "code": "FURTHER_EDUCATION",
              "name": { "zh": "继续深造", "en": "Further Education" },
              "category": "CAREER",
              "exitInterviewRecommended": true
            },
            {
              "code": "OTHER_VOLUNTARY",
              "name": { "zh": "其他个人原因", "en": "Other Personal Reasons" },
              "category": "OTHER",
              "exitInterviewRecommended": true
            }
          ]
        },
        {
          "code": "RESIGNATION_PROBATION",
          "name": { "zh": "试用期辞职", "en": "Probation Period Resignation" },
          "noticePeriodDays": 3,
          "requiresApproval": false,
          "severanceApplicable": false,
          "legalReference": "劳动合同法 第37条",
          "reasons": [
            {
              "code": "EXPECTATION_MISMATCH",
              "name": { "zh": "岗位预期不符", "en": "Role Expectation Mismatch" },
              "category": "CAREER"
            },
            {
              "code": "CULTURE_MISFIT",
              "name": { "zh": "文化不适应", "en": "Culture Misfit" },
              "category": "CULTURE"
            },
            {
              "code": "OTHER_PROBATION",
              "name": { "zh": "其他试用期原因", "en": "Other Probation Reasons" },
              "category": "OTHER"
            }
          ]
        }
      ]
    },
    {
      "code": "INVOLUNTARY",
      "name": { "zh": "被动离职/辞退", "en": "Involuntary Termination" },
      "description": { "zh": "用人单位主动解除劳动合同", "en": "Employer-initiated contract termination" },
      "legalReference": "劳动合同法 第39条、第40条、第41条",
      "subtypes": [
        {
          "code": "TERMINATION_WITH_CAUSE",
          "name": { "zh": "过失性辞退", "en": "Termination with Cause (Employee Fault)" },
          "noticePeriodDays": 0,
          "requiresApproval": true,
          "severanceApplicable": false,
          "legalReference": "劳动合同法 第39条",
          "approvalChain": ["direct_manager", "hr_bp", "legal_counsel"],
          "reasons": [
            {
              "code": "PROBATION_FAILURE",
              "name": { "zh": "试用期不符合录用条件", "en": "Probation Failure" },
              "category": "PERFORMANCE",
              "documentationRequired": ["performance_review", "coaching_record"],
              "legalReference": "劳动合同法 第39条第1项"
            },
            {
              "code": "SERIOUS_VIOLATION",
              "name": { "zh": "严重违反规章制度", "en": "Serious Rule Violation" },
              "category": "CONDUCT",
              "documentationRequired": ["disciplinary_record", "witness_statement", "rule_acknowledgment"],
              "legalReference": "劳动合同法 第39条第2项"
            },
            {
              "code": "SERIOUS_DAMAGE",
              "name": { "zh": "严重失职，营私舞弊", "en": "Gross Negligence / Malfeasance" },
              "category": "CONDUCT",
              "documentationRequired": ["investigation_report", "damage_assessment"],
              "legalReference": "劳动合同法 第39条第3项"
            },
            {
              "code": "CRIMINAL LIABILITY",
              "name": { "zh": "被依法追究刑事责任", "en": "Criminal Liability" },
              "category": "LEGAL",
              "documentationRequired": ["court_judgment"],
              "legalReference": "劳动合同法 第39条第6项"
            },
            {
              "code": "FRAUD_EMPLOYMENT",
              "name": { "zh": "以欺诈手段订立劳动合同", "en": "Employment Fraud" },
              "category": "LEGAL",
              "documentationRequired": ["fraud_evidence"],
              "legalReference": "劳动合同法 第39条第5项"
            },
            {
              "code": "MOONLIGHTING_CONFLICT",
              "name": { "zh": "兼职严重影响本职工作", "en": "Moonlighting Conflict" },
              "category": "CONDUCT",
              "documentationRequired": ["evidence_of_impact", "warning_record"],
              "legalReference": "劳动合同法 第39条第4项"
            }
          ]
        },
        {
          "code": "TERMINATION_WITHOUT_CAUSE",
          "name": { "zh": "非过失性辞退", "en": "Termination without Cause (No-Fault)" },
          "noticePeriodDays": 30,
          "noticeInLieuPay": true,
          "requiresApproval": true,
          "severanceApplicable": true,
          "severanceFormula": "N",
          "legalReference": "劳动合同法 第40条",
          "approvalChain": ["direct_manager", "hr_bp", "hr_director", "legal_counsel", "gm"],
          "reasons": [
            {
              "code": "MEDICAL_TERMINAL",
              "name": { "zh": "医疗期满不能从事原工作", "en": "Unable to Work After Medical Period" },
              "category": "MEDICAL",
              "documentationRequired": ["medical_assessment", "job_reassignment_attempt"],
              "legalReference": "劳动合同法 第40条第1项"
            },
            {
              "code": "INCOMPETENCE",
              "name": { "zh": "不能胜任工作，经培训或调岗仍不能胜任", "en": "Incompetence After Training/Transfer" },
              "category": "PERFORMANCE",
              "documentationRequired": ["performance_review", "pip_record", "training_record", "reassessment"],
              "legalReference": "劳动合同法 第40条第2项"
            },
            {
              "code": "MAJOR_CHANGE",
              "name": { "zh": "客观情况发生重大变化", "en": "Material Change in Circumstances" },
              "category": "BUSINESS",
              "documentationRequired": ["change_evidence", "negotiation_record"],
              "legalReference": "劳动合同法 第40条第3项"
            }
          ]
        },
        {
          "code": "LAYOFF",
          "name": { "zh": "经济性裁员", "en": "Economic Layoff" },
          "noticePeriodDays": 30,
          "requiresApproval": true,
          "severanceApplicable": true,
          "severanceFormula": "N",
          "legalReference": "劳动合同法 第41条",
          "governmentNotificationRequired": true,
          "approvalChain": ["hr_director", "legal_counsel", "cfo", "ceo", "board"],
          "reasons": [
            {
              "code": "BANKRUPTCY_RESTRUCTURING",
              "name": { "zh": "依照企业破产法进行重整", "en": "Bankruptcy Reorganization" },
              "category": "BUSINESS",
              "legalReference": "劳动合同法 第41条第1项"
            },
            {
              "code": "PRODUCTION_DIFFICULTY",
              "name": { "zh": "生产经营发生严重困难", "en": "Severe Business Difficulty" },
              "category": "BUSINESS",
              "legalReference": "劳动合同法 第41条第2项"
            },
            {
              "code": "TECHNOLOGICAL_CHANGE",
              "name": { "zh": "技术革新/重大技术变革", "en": "Technological Transformation" },
              "category": "BUSINESS",
              "legalReference": "劳动合同法 第41条第3项"
            },
            {
              "code": "ECONOMIC_DOWNTURN",
              "name": { "zh": "经济环境重大变化", "en": "Economic Downturn" },
              "category": "BUSINESS",
              "legalReference": "劳动合同法 第41条第4项"
            }
          ],
          "protectedGroups": [
            {
              "code": "LONG_TERM_CONTRACT",
              "description": { "zh": "订立较长期限固定期限合同的", "en": "Employees with long-term fixed contracts" }
            },
            {
              "code": "NO_ALTERNATIVE",